product_id,product_name,price,detail,published_date,publisher,product_image,author
93,Python 실습으로 기초부터 (컴퓨팅 사고를 키우기 위한 첫 걸음),20000,"여러 사회적인 문제들을 소프트웨어로 해결하기 위한 컴퓨팅 사고 능력을 배양하려는 다양한 교육방법이 개발되고 있다. 그 가운데 프로그래밍 언어를 이용하여 프로그래밍 개념을 정립하고 이를 바탕으로 문제해결 방법을 학습하는 소프트웨어 개발을 위한 코딩 교육이 부각되고 있다. 최근에는 전공자뿐만 아니라 비전공자에게 직관적이고 간결하며 이해하기 쉬운 Python이 프로그래밍 학습을 위한 언어로 주목을 받고 있다. 따라서 이 책에서는 독자가 컴퓨팅 사고를 학습하는 데 도움이 되는 Python을 보다 쉽게 이해하고 학습할 수 있도록 다양한 예제와 도식을 이용하여 설명하고 있다.

초급학습자와 중급학습자를 구분하여 컴퓨터 비전공자들에게는 Python 프로그램을 쉽게 학습할 수 있도록 하였고, 컴퓨터 전공자들에게는 보다 심도 있는 학습이 가능하도록 구성하였다. 단순히 컴퓨터 프로그래밍에 대한 기초만을 학습한 후 더 이상 필요치 않는 교재가 아니라 깊이 있는 학습을 요구하는 학습자에게도 도움이 될 수 있을 것이다. 그리고 오늘날 개발되는 대부분의 소프트웨어들은 컴퓨터 언어 중 객체지향 언어로 개발되고 있는데, 객체지향 프로그래밍은 컴퓨터 프로그램에서 매우 중요한 개념이다. 때문에 이 책에서도 이와 같은 중요한 개념들을 최대한 쉽게 소개하려고 노력했다. 앞에서 개념들을 다소 이해하기 어려움이 있을 수 있기 때문에 심도 있는 학습을 원하는 학습자를 위해 뒤쪽으로 배치해 완전히 숙지할 수 있도록 하였다.",20170825,서현사,\img\Python 실습으로 기초부터 (컴퓨팅 사고를 키우기 위한 첫 걸음).jpg,이진영
94,Python 프로그래밍의 이해,20000,"이 교재는 프로그래밍을 처음 배우는 학생들을 대상으로 C 언어나 Java 언어를 배우기 전에 소프트웨어 및 프로그래밍을 이해하기 위한 교재로 사용할 수 있다. 이 교재는 소프트웨어의 기본 개념, 문제 해결, 순서도 등의 프로그래밍을 위한 기초 지식을 먼저 소개하고 이를 바탕으로 프로그래밍의 기본 개념부터 그래픽 프로그래밍까지 소개한다. 총 13개의 장으로 구성하여 간단한 예제 프로그램과 다양한 그래픽 프로그램을 포함하여 초보자들이 쉽게 이해하면서 진행할 수 있도록 하였으며 각 장마다 실습을 위한 실습문제와 연습문제를 포함하였다.",20170117,교보문고,\img\Python 프로그래밍의 이해.jpg,창병모^유석종^이상규
95,"Testing Python (Applying Unit Testing, TDD, BDD and Acceptance Testing)",65960,"Fundamental testing methodologies applied to the popular Python language   Testing Python; Applying Unit Testing, TDD, BDD and Acceptance Testing  is the most comprehensive book available on testing for one of the top software programming languages in the world.",20140818,John Wiley & Sons,"\img\Testing Python (Applying Unit Testing, TDD, BDD and Acceptance Testing).jpg",Unknown
96,Computational Physics: Problem Solving with Python (Problem Solving with Python),76000,"The use of computation and simulation has become an essential part of the scientific process. Being able to transform a theory into an algorithm requires significant theoretical insight, detailed physical and mathematical understanding, and a working level of competency in programming.",20150908,Wiley-Vch,,RH Landau
97,"인과관계 추론과 발견 with Python (실제 사례를 접목한 이론서, 한국어판)",35150,이 책은 인과관계 추론과 발견에 대해 다룬 도서입니다. 기초적이고 전반적인 내용을 학습할 수 있습니다.,20240223,홍릉,"\img\인과관계 추론과 발견 with Python (실제 사례를 접목한 이론서, 한국어판).jpg",김민경^김수환
98,Python 프로그래밍 정복하기 (창의적 사고를 위한),22500,"『창의적 사고를 위한 Python 프로그래밍 정복하기』는 처음으로 컴퓨터 프로그래밍을 학습하는 컴퓨터공학 비전공자 및 저학년의 컴퓨터공학 전공자를 위해 작성되었다. 따라서 컴퓨터 프로그래밍을 학습하는 초보자들이 반드시 알아야할 프로그래밍의 개념과 문법적 표현을 중심으로 다루었다. 뿐만 아니라, 성적 처리 시스템 구현이라는 하나의 주제를 두고서 각 장에서 다룬 내용이 이를 구현하는데 어떻게 적용되는 지를 예를 들어서 설명하였다. 이는 프로그래밍 초보자들이 자신이 아는 지식을 어떠한 상황에 사용해야하는 지에 대한 실제적 예를 보여주며, 컴퓨터 프로그래밍 학습에 많은 도움을 준다. 또한 각 장마다 연습문제를 제공하여 학습한 내용을 복습하고 정리할 수 있도록 하였다.",20160201,북스홀릭퍼블리싱,\img\Python 프로그래밍 정복하기 (창의적 사고를 위한).jpg,강남오^김재호
99,Natural Language Processing: Python and NLTK (Python and Nltk),69000,"Learn to build expert NLP and machine learning projects using NLTK and other Python libraries

About This Book
* Break text down into its component parts for spelling correction, feature extraction, and phrase transformation
* Work through NLP concepts with simple and easy-to-follow programming recipes
* Gain insights into the current and budding research topics of NLP

Who This Book Is For
If you are an NLP or machine learning enthusiast and an intermediate Python programmer who wants t",20180301,Packt Publishing,,Nitin Hardeniya^Jacob Perkins^Deepti Chopra^Nisheeth Joshi^Iti Mathur
100,Learning Python,42000,"Learning Python has a dynamic and varied nature. It reads easily and lays a good foundation for those who are interested in digging deeper. It has a practical and example-oriented approach through which both the introductory and the advanced topics are explained. Starting with the fundamentals of programming and Python, it ends by exploring very different topics, like GUIs, web apps and data science. The book takes you all the way to creating a fully fledged application.",20170501,Packt Publishing,\img\Learning Python.jpg,Fabrizio Romano
